$$Name$DocumentClauseSet.Name$DocumentClauseSet.CategoryReference.DeveloperName,BusinessUnit,Content,Country,DataSource,Description,DocumentClauseSet.$$Name$CategoryReference.DeveloperName,Format,IsAlternateClause,Language,Name,Organization,Region,ReportingYear,Status,ValidEndDate,ValidStartDate,Version
MainClause_Spanish_Two;CS_AllLanguage_2;Retail,,"Durante más de un siglo, los automóviles han sido un símbolo de destreza de ingeniería debido a su hardware: motores, transmisiones, frenos, ejes y otras partes físicas. Ahora, sin embargo, hemos ingresado a la era del vehículo definido por software donde el software, no el hardware, da forma a la experiencia de conducción.

La noción de un automóvil conectado ha evolucionado durante décadas. Los sistemas de comunicaciones basados ​​en emergencias que permiten a los conductores solicitar ayuda con la presentación de un botón han existido durante 30 años. Poco a poco, se ha implementado más software para controlar la experiencia de hardware y conducción, y más potencia de cálculo, datos, y la IA ha permitido todo, desde el enrutamiento GPS hasta la evitación de bloqueo hasta la conducción autónoma.

Ahora, sin embargo, hemos ingresado a la era del vehículo definido por software, donde el software, no el hardware, da forma a la experiencia de conducción.

Algunos autos, especialmente los EV de la tecnología, son un presagio del que jugará el software dominante en la ecuación automotriz en el futuro. Pero los automóviles que se estacionan, ofrecen orientación a la estación de gas o carga más cercana, la señal necesaria para las reparaciones o extrae los programas favoritos de un niño: estas no serán agradables y primas en el futuro, vendrán de manera estándar. en cada vehículo. Y la clave para habilitar estas experiencias son los cientos de sensores a bordo y grandes cantidades de datos provenientes del automóvil.

Un ""cambio sísmico"" en la industria automotriz
Dentro de las paredes de Salesforce, no hay nadie que pueda hablar con estas experiencias de automóviles conectados y basados ​​en datos mejor que Achyut Jajoo. Aunque ahora es el SVP y GM de Automotriz y Manufactura de la compañía, Jazoo comenzó su carrera como ingeniero en Detroit, diseñando automóviles y camiones.

""Mucha gente no entiende completamente cuán sísmica está pasando la industria automotriz hoy. Escuchamos sobre la muerte de los vehículos de gas y la revolución eléctrica, pero la mayor transformación es una reinvención de la arquitectura subyacente de lo que hace un automóvil. Una vez que todos los automóviles, eléctricos, híbridos o de gas, están más definidos por software y conectados, las capacidades y posibilidades de experiencias de manejo más agradables, seguras y sostenibles crecerán exponencialmente "", según JAJOO.

De hecho, dijo, el automóvil conectado conectará a los conductores, fabricantes, distribuidores y prestamistas de automóviles de manera que cree experiencias más personalizadas y niveles más altos de servicio al cliente.

Una vez que todos los automóviles, eléctricos, híbridos o de gas, están más definidos por software y conectados, las capacidades y posibilidades para experiencias de manejo más agradables, seguras y sostenibles crecerán exponencialmente.

Achyut Jazoo, SVP y GM, Automotive and Manufacturing
Por un lado, los automóviles ya no se limitarán a las características y actualizaciones seleccionadas en un concesionario. Si bien algunos de los EV más avanzados ya han comenzado en este camino, pronto muchos más automóviles y camiones serán máquinas dinámicas y actualizables al instante gracias al software, la conectividad y los volúmenes de datos de telemetría que genera un automóvil.

""Entonces, ahora en tiempo real, los datos que provienen del automóvil pueden ayudar a dar forma a las características y cambiar la forma en que está experimentando el automóvil en sí"", dijo Jajoo.

Por ejemplo, un fabricante de automóviles puede recibir datos de telemetría en tiempo real que uno de sus vehículos ha comenzado un viaje por carretera, pero el conductor no tiene instalado el servicio de optimización de viaje. Para ayudar, envían inmediatamente una notificación a través del sistema de información y entretenimiento del automóvil para instalar el servicio. Ahora, el software del automóvil puede mostrar al conductor las mejores paradas de descanso, dónde recargar o repostar al menor costo y otras características que harán que el viaje sea más fácil y más agradable.",,,MainClause_Spanish_Two Description,CS_AllLanguage_2;Retail,Non_Formatted,false,es,MainClause_Spanish_Two,,,,Draft,,,1
MainClause_Italian_Two;CS_AllLanguage_2;Retail,,"Per più di un secolo, le auto sono state un simbolo dell'abilità ingegneristica a causa del loro hardware: motori, trasmissioni, freni, assi e altre parti fisiche. Ora, tuttavia, siamo entrati nell'era del veicolo definito dal software in cui il software, non l'hardware, modella l'esperienza di guida.

La nozione di auto connessa si è evoluta per decenni. I sistemi di comunicazione basati sull'emergenza che consentono ai conducenti di chiedere aiuto con la spinta di un pulsante sono in circolazione da 30 anni. A poco più software sono stati implementati per controllare l'hardware e l'esperienza di guida - e più calcola potenza, dati e AI hanno abilitato tutto, dal routing GPS all'eliminazione degli arresti anomali alla guida autonoma.

Ora, tuttavia, siamo entrati nell'era del veicolo definito dal software, in cui il software, non hardware, modella l'esperienza di guida.

Alcune auto, in particolare i veicoli elettrici tecnologici, sono un presagio del software di ruolo dominante che giocheranno nell'equazione automobilistica in futuro. Ma le automobili che parcheggiano, offrono una guida al gas o alla stazione di ricarica più vicini, il segnale ha bisogno di riparazioni o tirano su spettacoli preferiti di un bambino: questi non saranno caratteristiche premium in futuro, verranno standard, verranno standard su ogni veicolo. E la chiave per consentire queste esperienze sono le centinaia di sensori di bordo e grandi quantità di dati provenienti dall'auto.

Un ""cambiamento sismico"" nel settore automobilistico
All'interno delle mura di Salesforce, non c'è nessuno che possa parlare con queste esperienze automobilistiche connesse e connesse meglio di Achyut Jajoo. Anche se ora è SVP e GM dell'azienda di automobili e manifatturieri, Jajoo ha iniziato la sua carriera come ingegnere a Detroit, progettando auto e camion.

""Molte persone non comprendono appieno quanto sia il cambiamento sismico che l'industria automobilistica stia attraversando oggi. Sentiamo parlare della morte dei veicoli a gas e della rivoluzione elettrica, ma la più grande trasformazione è una reimmaginazione dell'architettura sottostante di ciò che rende un'auto. Una volta che tutte le auto-elettriche, ibride o gas-sono più definite e connesse, le capacità e le possibilità per esperienze di guida più divertenti, sicure e sostenibili aumenteranno in modo esponenziale ”, secondo Jajoo.

In effetti, ha detto, l'auto connessa collegherà conducenti, produttori, rivenditori e finanziatori auto in modi che creano esperienze più personalizzate e livelli più elevati di servizio clienti.

Una volta che tutte le auto-elettriche, ibride o gas-sono più definite e connesse, le capacità e le possibilità per esperienze di guida più divertenti, sicure e sostenibili aumenteranno esponenzialmente.

Achyut Jajoo, SVP e GM, Automotive e Manufacturing
Per uno, le auto non saranno più limitate alle funzionalità e agli aggiornamenti selezionati in una concessionaria. Mentre alcuni dei veicoli elettrici più avanzati hanno già iniziato questo percorso, presto molte più auto e camion saranno macchine dinamiche e immediatamente aggiornabili grazie al software, alla connettività e ai volumi di dati di telemetria che un'auto genera.

""Quindi ora in tempo reale, i dati che provengono dall'auto possono aiutare a modellare le caratteristiche e cambiare il modo in cui stai vivendo l'auto stessa"", ha detto Jajoo.

Ad esempio, un produttore automobilistico può ricevere dati di telemetria in tempo reale che uno dei loro veicoli ha iniziato un viaggio, ma il conducente non ha un servizio di ottimizzazione dei viaggi. Per aiutare, inviano immediatamente una notifica tramite il sistema di infotainment dell'auto per installare il servizio. Ora, il software dell'auto può mostrare al conducente le migliori fermate di riposo, dove ricaricare o fare riferimento al costo più basso e altre funzionalità che renderà il viaggio più semplice e divertente.",,,MainClause_Italian_Two Description,CS_AllLanguage_2;Retail,Non_Formatted,false,it,MainClause_Italian_Two,,,,Active,,,1
MainClause_Swedish_Two;CS_AllLanguage_2;Retail,,"I mer än ett sekel har bilar varit en symbol för teknisk förmåga på grund av deras hårdvara: motorer, växellådor, bromsar, axlar och andra fysiska delar. Nu har vi emellertid gått in i eran för det mjukvarudefinierade fordonet där programvara, inte hårdvara, formar körupplevelsen.

Uppfattningen om en ansluten bil har utvecklats i årtionden. Nödbaserade kommunikationssystem som gör det möjligt för förare att ringa efter hjälp med en knapptryckning har funnits i 30 år. Gradvis har mer programvara implementerats för att kontrollera hårdvaru- och körupplevelsen - och mer datorkraft, data och AI har gjort det möjligt för allt från GPS -routing att krascha undvikande till autonom körning.

Nu har vi emellertid gått in i eran för det mjukvarudefinierade fordonet, där programvara, inte hårdvara, formar körupplevelsen.

Vissa bilar, särskilt de tekniska Forward EVs, är en föregångare av den dominerande rollprogramvaran kommer att spela i bilekvationen framöver. Men bilar som parkerar sig själva, erbjuder vägledning till närmaste gas- eller laddningsstation, signal behövs reparationer eller drar upp ett barns favoritprogram-dessa kommer inte att vara trevliga att ha, premiumfunktioner i framtiden, de kommer standard på varje fordon. Och nyckeln till att möjliggöra dessa upplevelser är hundratals ombordssensorer och stora mängder data som kommer från bilen.

En ""seismisk förändring"" i bilindustrin
Inom väggarna i Salesforce finns det ingen som kan prata med dessa datadrivna, anslutna bilupplevelser bättre än Achyut Jajoo. Även om han nu är företagets SVP och GM för bil och tillverkning, började Jajoo sin karriär som ingenjör i Detroit och designade bilar och lastbilar.

”Många människor förstår inte helt hur seismisk en förändring bilindustrin går igenom idag. Vi hör om döden av gasfordon och den elektriska revolutionen, men den största omvandlingen är en återintegrering av den underliggande arkitekturen för vad som gör en bil. När alla bilar-elektriska, hybrid eller gas-är mer mjukvarudefinierade och anslutna, kommer kapaciteten och möjligheterna för roligare, säkra och hållbara körupplevelser att växa exponentiellt, ”enligt Jajoo.

I själva verket, sade han, kommer den anslutna bilen att ansluta förare, tillverkare, återförsäljare och bilförlånare på sätt som skapar mer personliga upplevelser och högre nivåer av kundservice.

När alla bilar-elektriska, hybrid eller gas-är mer mjukvarudefinierade och anslutna kommer kapaciteten och möjligheterna för roligare, säkra och hållbara körupplevelser att växa exponentiellt.

Achyut Jajoo, SVP och GM, Automotive and Manufacturing
För det första kommer bilar inte längre att begränsas till de funktioner och uppgraderingar som valts till en återförsäljare. Medan några av de mer avancerade EV: erna redan har börjat på denna väg, kommer snart många fler bilar och lastbilar att vara dynamiska, omedelbart uppgraderade maskiner tack vare programvaran, anslutningen och volymerna av telemetri-data som en bil genererar.

""Så nu i realtid kan de data som kommer från bilen hjälpa till att forma funktionerna och ändra hur du upplever själva bilen,"" sade Jajoo.

Till exempel kan en biltillverkare få telemetri-data i realtid som ett av deras fordon har startat en bilresa, men föraren har inte resoptimeringstjänst installerad. För att hjälpa skickar de omedelbart ett meddelande via bilens infotainment -system för att installera tjänsten. Nu kan bilens programvara visa föraren de bästa vilostoppen, var man ska ladda eller tanka till lägsta kostnad och andra funktioner som gör resan enklare och roligare.",,,MainClause_Swedish_Two Description,CS_AllLanguage_2;Retail,Non_Formatted,false,sv,MainClause_Swedish_Two,,,,Draft,,,1
MainClause_Chinese(Traditional)_Two;CS_AllLanguage_2;Retail,,"一個多世紀以來，汽車一直是工程能力的象徵，因為它們的硬件：發動機，變速器，制動器，車軸和其他物理部件。但是，現在，我們進入了軟件定義的車輛的時代，軟件而不是硬件可以塑造駕駛體驗。

連接汽車的概念已經發展了數十年。允許駕駛員在按鈕時尋求幫助的緊急通信系統已經存在了30年。逐漸實施了更多的軟件來控制硬件和駕駛體驗 - 更多的計算功率，數據和AI使從GPS路由到避免崩潰到自動駕駛的所有內容。

但是，現在，我們進入了軟件定義的車輛時代，在這裡，軟件而不是硬件可以塑造駕駛體驗。

一些汽車，尤其是技術前進的電動汽車，是在汽車方程中扮演的主要角色軟件的預兆。但是自行停車的汽車，為最近的汽油或充電站提供指導，信號需要維修或拉起孩子最喜歡的節目 - 這些節目將來不會是不錯的優質功能，它們將成為標準的標準在每輛車上。實現這些體驗的關鍵是車載傳感器和大量來自汽車的數據。

汽車行業的“地震轉變”
在Salesforce的牆壁內，沒有人能比Achyut Jajoo更好地與這些數據驅動的，連接的汽車體驗交談。儘管他現在是該公司的汽車和製造業總經理，但Jajoo開始了他在底特律的工程師的職業生涯，設計了汽車和卡車。

“很多人都不完全了解汽車行業今天正在發生的地震轉變。我們聽說了汽油汽車和電動革命的死亡，但最大的轉變是對製造汽車的基礎建築的重新構想。一旦所有汽車（電動，混合或天然氣）都是更明確的和連接的，那麼更愉快，安全和可持續的駕駛體驗的功能和可能性將成倍增長，” Jajoo說。

他說，實際上，連接的汽車將以創造更多個性化體驗和更高水平的客戶服務的方式將驅動程序，製造商，經銷商和汽車貸方連接起來。

一旦所有汽車（電動，混合或天然氣）都更加定義和連接，那麼更愉快，安全和可持續的駕駛體驗的功能和可能性將成倍增長。

Achyut Jajoo，高級副總裁和通用汽車，汽車和製造業
首先，汽車將不再僅限於經銷商選擇的功能和升級。儘管一些更高級的電動汽車已經開始沿著這條路開始，但由於汽車生成的軟件，連接性和遙測數據，很快，更多的汽車和卡車將是動態的，可立即升級的機器。

Jajoo說：“因此，現在是實時的，來自汽車的數據可以幫助塑造功能，並改變您體驗您的汽車本身的方式。”

例如，汽車製造商可能會收到他們的一輛汽車開始公路旅行的實時遙測數據，但駕駛員沒有安裝旅行優化服務。為了提供幫助，他們立即通過汽車的信息娛樂系統發送通知以安裝服務。現在，汽車的軟件可以向駕駛員展示最佳的休息站，以最低的成本充電或加油，以及其他功能，這些功能將使旅行更輕鬆，更愉快。",,,MainClause_Chinese(Traditional)_Two Description,CS_AllLanguage_2;Retail,Non_Formatted,false,zh_TW,MainClause_Chinese(Traditional)_Two,,,,Draft,,,1
MainClause_Portuguese(Brazil)_Two;CS_AllLanguage_2;Retail,,"Por mais de um século, os carros têm sido um símbolo de proezas de engenharia por causa de seu hardware: motores, transmissões, freios, eixos e outras partes físicas. Agora, no entanto, entramos na era do veículo definido por software em que software, não hardware, molda a experiência de dirigir.

A noção de um carro conectado está evoluindo há décadas. Os sistemas de comunicação baseados em emergência que permitem que os motoristas pedam ajuda com o empurrão de um botão existe há 30 anos. Gradualmente, mais software foi implementado para controlar o hardware e a experiência de condução - e mais energia, dados e IA de computação, e a IA permitiu tudo, desde o roteamento de GPS até a prevenção de falhas até a direção autônoma.

Agora, no entanto, entramos na era do veículo definido por software, onde software, não hardware, molda a experiência de dirigir.

Alguns carros, especialmente os EVs da tecnologia, são um prenúncio do software de função dominante na equação automotiva daqui para frente. Mas os carros que estacionam-se, oferecem orientação para a estação de gás ou de carregamento mais próxima, os reparos do sinal necessários ou puxam os programas favoritos de uma criança-eles não serão bons de ter recursos premium no futuro, eles virão padrão em cada veículo. E a chave para permitir essas experiências são as centenas de sensores a bordo e vastas quantidades de dados provenientes do carro.

Uma ""mudança sísmica"" na indústria automobilística
Dentro das paredes do Salesforce, não há ninguém que possa falar com essas experiências de carro conectadas e orientadas por dados melhor do que Achyut Jajoo. Embora ele agora seja o vice -presidente sênior e GM da empresa de automóveis e fabricação, Jajoo iniciou sua carreira como engenheiro em Detroit, projetando carros e caminhões.

""Muitas pessoas não entendem completamente como a mudança sísmica pela indústria automobilística está passando hoje. Ouvimos falar da morte de veículos a gás e da revolução elétrica, mas a maior transformação é a reimaginação da arquitetura subjacente do que faz um carro. Depois que todos os carros-elétricos, híbridos ou gases-são mais definidos e conectados a software, as capacidades e possibilidades de experiências de direção mais agradáveis, seguras e sustentáveis ​​crescerão exponencialmente ”, segundo Jajoo.

De fato, ele disse, o carro conectado conectará motoristas, fabricantes, revendedores e credores de automóveis de maneiras que criam experiências mais personalizadas e níveis mais altos de atendimento ao cliente.

Uma vez que todos os carros-elétricos, híbridos ou gases-são mais definidos e conectados a software, as capacidades e possibilidades de experiências de direção mais agradáveis, seguras e sustentáveis ​​crescerão exponencialmente.

Achyut Jajoo, SVP e GM, automotivo e fabricação
Por um lado, os carros não serão mais limitados aos recursos e atualizações selecionadas em uma concessionária. Embora alguns dos VEs mais avançados já tenham iniciado esse caminho, em breve muitos outros carros e caminhões serão máquinas dinâmicas e instantaneamente atualizáveis, graças ao software, conectividade e volumes de dados de telemetria que um carro gera.

""Então, agora em tempo real, os dados que são provenientes do carro podem ajudar a moldar os recursos e mudar a maneira como você está experimentando o próprio carro"", disse Jajoo.

Por exemplo, um fabricante de automóveis pode receber dados de telemetria em tempo real que um de seus veículos iniciou uma viagem, mas o motorista não possui serviço de otimização de viagem instalado. Para ajudar, eles enviam imediatamente uma notificação através do sistema de infotainment do carro para instalar o serviço. Agora, o software do carro pode mostrar ao motorista as melhores paradas de descanso, onde recarregar ou reabastecer com o menor custo e outros recursos que tornarão a viagem mais fácil e agradável.",,,MainClause_Portuguese(Brazil)_Two Description,CS_AllLanguage_2;Retail,Non_Formatted,false,pt_BR,MainClause_Portuguese(Brazil)_Two,,,,Active,,,1
MainClause_Danish_Two;CS_AllLanguage_2;Retail,,"I mere end et århundrede har biler været et symbol på teknisk dygtighed på grund af deres hardware: motorer, transmissioner, bremser, aksler og andre fysiske dele. Nu er vi dog kommet ind i æraen med det softwaredefinerede køretøj, hvor software, ikke hardware, former køreoplevelsen.

Forestillingen om en tilsluttet bil har udviklet sig i årtier. Nødbaserede kommunikationssystemer, der giver chauffører mulighed for at ringe til hjælp til et tryk på en knap, har eksisteret i 30 år. Efterhånden er der implementeret mere software til at kontrollere hardware- og køreoplevelsen - og mere beregnet strøm, data og AI har gjort det muligt for alt fra GPS -routing til at undgå at undgå autonom kørsel.

Nu er vi dog kommet ind i æraen med det softwaredefinerede køretøj, hvor software, ikke hardware, former køreoplevelsen.

Nogle biler, især de teknologiske EV'er, er en harbinger af den dominerende rollesoftware, der spiller i Automotive-ligningen fremover. Men biler, der parkerer sig selv, tilbyder vejledning til den nærmeste gas- eller opladningsstation, signalbehovsreparationer eller trækker et barns yndlingsshow-disse vil ikke være gode at have, premium-funktioner i fremtiden, de kommer standard på hvert køretøj. Og nøglen til at muliggøre disse oplevelser er de hundreder af ombord sensorer og store mængder data, der kommer fra bilen.

Et 'seismisk skift' i bilindustrien
Inden for Salesforce-murerne er der ingen, der kan tale med disse datadrevne, tilsluttede biloplevelser bedre end Achyut Jajoo. Selvom han nu er virksomhedens SVP og GM for bilindustrien og fremstillingen, startede Jajoo sin karriere som ingeniør i Detroit og designede biler og lastbiler.

”Mange mennesker forstår ikke fuldt ud, hvordan seismisk et skift bilindustrien går igennem i dag. Vi hører om gaskøretøjernes død og den elektriske revolution, men den største transformation er en reimaginering af den underliggende arkitektur af, hvad der gør en bil. Når alle biler-elektrisk, hybrid eller gas-er mere softwaredefinerede og forbundne, vil mulighederne og mulighederne for sjovere, sikre og bæredygtige køreoplevelser vokse eksponentielt, ”ifølge Jajoo.

Faktisk, sagde han, vil den tilsluttede bil forbinde drivere, producenter, forhandlere og auto -långivere på måder, der skaber mere personaliserede oplevelser og højere niveauer af kundeservice.

Når alle biler-elektrisk, hybrid eller gas-er mere softwaredefineret og forbundet, vil mulighederne og mulighederne for sjovere, sikre og bæredygtige kørselsoplevelser vokse eksponentielt.

Achyut Jajoo, SVP og GM, Automotive and Manufacturing
For det første vil biler ikke længere være begrænset til de funktioner og opgraderinger, der er valgt til et forhandler. Mens nogle af de mere avancerede EV'er allerede er startet ned på denne sti, vil snart mange flere biler og lastbiler være dynamiske, øjeblikkeligt opgraderbare maskiner takket være softwaren, forbindelsen og mængderne af telemetri-data, som en bil genererer.

”Så nu i realtid kan de data, der kommer fra bilen, hjælpe med at forme funktionerne og ændre den måde, du oplever selve bilen på,” sagde Jajoo.

For eksempel kan en bilproducent muligvis modtage realtids telemetri-data, som et af deres køretøjer har startet en road trip, men føreren har ikke installeret TRIP-optimeringstjeneste. For at hjælpe sender de straks en meddelelse gennem bilens infotainment -system for at installere tjenesten. Nu kan bilens software vise chaufføren de bedste hvilestop, hvor man skal genoplade eller tanke til de laveste omkostninger, og andre funktioner, der vil gøre turen lettere og sjovere.",,,MainClause_Danish_Two Description,CS_AllLanguage_2;Retail,Non_Formatted,false,da,MainClause_Danish_Two,,,,Draft,,,1
