$$Name$DocumentClauseSet.Name$DocumentClauseSet.CategoryReference.DeveloperName,BusinessUnit,Content,Country,DataSource,Description,DocumentClauseSet.$$Name$CategoryReference.DeveloperName,Format,IsAlternateClause,Language,Name,Organization,Region,ReportingYear,Status,ValidEndDate,ValidStartDate,Version
AlternateClause_Dutch_One;CS_AllLanguage_1;Contract,,"<p><strong style=""font-size: 24px;""><em><u>Salesforce Auto Partners</u></em></strong></p><p>Al meer dan een eeuw zijn auto's een symbool van technische dapperheid vanwege hun hardware: motoren, transmissies, remmen, assen en andere fysieke onderdelen. Nu zijn we echter het tijdperk van het softwaregedefinieerde voertuig ingevoerd waar software, niet hardware, de rijervaring vormt.&nbsp;&nbsp;</p><ul><li>Het idee van een verbonden auto evolueert al tientallen jaren. Op noodsituaties gebaseerde communicatiesystemen waarmee stuurprogramma's om hulp kunnen vragen bij de druk op de knop bestaan ​​al 30 jaar./li><li>Geleidelijk is meer software geïmplementeerd om de hardware- en rijervaring te regelen - en meer rekenkracht, gegevens en AI heeft alles mogelijk gemaakt, van GPS -routing tot het crashen van vermijding tot autonoom rijden. & NBSP; Nu zijn we echter het tijdperk ingegaan van de tijd Software-gedefinieerd voertuig, waar software, geen hardware, de rijervaring vormt.</li></ul><p>Sommige auto's, met name de technologie-forward EV's, zijn een voorbode van de dominante rolsoftware die in de automobielvergelijking in de toekomst zal spelen. Maar auto's die zelf parkeren, begeleiding bieden aan het dichtstbijzijnde gas- of laadstation, signaal benodigde reparaties of de favoriete shows van een kind ophalen-dit zullen niet leuk zijn om in de toekomst premium-functies te hebben, ze komen standaard Op elk voertuig. En de sleutel tot het inschakelen van deze ervaringen zijn de honderden ingebouwde sensoren en enorme hoeveelheden gegevens uit de auto.</p><p><br></p><h2>Een ‘seismische verschuiving’ in de auto -industrie. Binnen de muren van Salesforce is er niemand die met deze gegevensgestuurde, verbonden auto-ervaringen beter kan spreken dan&nbsp;<a href=""https://www.linkedin.com/in/achyutjajoo/"" rel=""noopener noreferrer"" target=""_blank"">Achyut Jajoo</a>. Hoewel hij nu de SVP en GM van het bedrijf is van Automotive and Manufacturing, begon Jajoo zijn carrière als ingenieur in Detroit en ontwerpt ze auto's en vrachtwagens.</h2><p>Veel mensen begrijpen niet volledig hoe seismisch een verschuiving de auto -industrie vandaag doormaakt. We horen over de dood van gasvoertuigen en de elektrische revolutie, maar de grootste transformatie is een herbeeld van de onderliggende architectuur van wat een auto maakt. Zodra alle auto's-elektrisch, hybride of gas-meer software-gedefinieerd en verbonden zijn, zullen de mogelijkheden en mogelijkheden voor meer plezierige, veilige en duurzame rijervaringen exponentieel groeien, ”aldus Jajoo.</p><p><img src=""https://www.salesforce.com/news/wp-content/uploads/sites/3/2023/03/ConnectedCar.jpg?w=300""></p><p>Inderdaad, zei hij, de verbonden auto zal chauffeurs, fabrikanten, dealers en auto -kredietverstrekkers verbinden op manieren die meer gepersonaliseerde ervaringen en hogere niveaus van klantenservice creëren.</p>",,,AlternateClause_Dutch_One Description,CS_AllLanguage_1;Contract,Rich_Text,true,nl_NL,AlternateClause_Dutch_One,,,,Draft,,,1
AlternateClause_Thai_One;CS_AllLanguage_1;Contract,,"<p><strong style=""font-size: 24px;""><em><u>Salesforce Automobile Partners</u></em></strong></p><p>เป็นเวลากว่าศตวรรษที่รถยนต์เป็นสัญลักษณ์ของความกล้าหาญทางวิศวกรรมเนื่องจากฮาร์ดแวร์ของพวกเขา: เครื่องยนต์, การส่งสัญญาณ, เบรก, เพลาและชิ้นส่วนทางกายภาพอื่น ๆ อย่างไรก็ตามตอนนี้เราได้เข้าสู่ยุคของยานพาหนะที่กำหนดซอฟต์แวร์ซึ่งซอฟต์แวร์ไม่ใช่ฮาร์ดแวร์ทำให้เกิดประสบการณ์การขับขี่&nbsp;&nbsp;</p><ul><li>แนวคิดของรถที่เชื่อมต่อได้รับการพัฒนามานานหลายทศวรรษ ระบบการสื่อสารตามเหตุฉุกเฉินที่อนุญาตให้ผู้ขับขี่ขอความช่วยเหลือเกี่ยวกับการกดปุ่มได้ประมาณ 30 ปีแล้ว ../li><li>มีการใช้ซอฟต์แวร์มากขึ้นเรื่อย ๆ เพื่อควบคุมประสบการณ์ฮาร์ดแวร์และการขับขี่ - และการคำนวณพลังงานข้อมูลและ AI ได้เปิดใช้งานทุกอย่างตั้งแต่การกำหนดเส้นทาง GPS ไปจนถึงการหลีกเลี่ยงการชนไปจนถึงการขับขี่แบบอิสระ & nbsp; ยานพาหนะที่กำหนดด้วยซอฟต์แวร์ซึ่งซอฟต์แวร์ไม่ใช่ฮาร์ดแวร์กำหนดประสบการณ์การขับขี่</li></ul><p>รถยนต์บางคันโดยเฉพาะอย่างยิ่ง EV-forward EVs เป็นลางสังหรณ์ของซอฟต์แวร์บทบาทที่โดดเด่นจะเล่นในสมการยานยนต์ในอนาคต แต่รถยนต์ที่จอดเองให้คำแนะนำแก่สถานีบริการก๊าซหรือเครื่องชาร์จที่ใกล้ที่สุดสัญญาณการซ่อมแซมที่จำเป็นหรือดึงรายการโปรดของเด็ก ๆ-สิ่งเหล่านี้จะไม่ดีต่อคุณสมบัติพรีเมี่ยมในอนาคตพวกเขาจะมามาตรฐาน บนยานพาหนะทุกคัน และกุญแจสำคัญในการเปิดใช้งานประสบการณ์เหล่านี้คือเซ็นเซอร์ออนบอร์ดหลายร้อยตัวและข้อมูลจำนวนมากที่มาจากรถ</p><p><br></p><h2>การเปลี่ยนแปลงแผ่นดินไหว' ในอุตสาหกรรมยานยนต์ ภายในผนังของ Salesforce ไม่มีใครสามารถพูดคุยกับประสบการณ์รถยนต์ที่เชื่อมต่อข้อมูลได้ดีกว่าข้อมูลเหล่านี้ดีกว่า&nbsp;<a href=""https://www.linkedin.com/in/achyutjajoo/"" rel=""noopener noreferrer"" target=""_blank"">Achyut Jajoo</a>. แม้ว่าตอนนี้เขาเป็น SVP และ GM ของยานยนต์และการผลิตของ บริษัท Jajoo เริ่มอาชีพของเขาในฐานะวิศวกรในดีทรอยต์ออกแบบรถยนต์และรถบรรทุก</h2><p>ผู้คนจำนวนมากไม่เข้าใจอย่างถ่องแท้ว่าการเปลี่ยนแผ่นดินไหวของอุตสาหกรรมยานยนต์กำลังดำเนินไปในวันนี้อย่างไร เราได้ยินเกี่ยวกับการตายของยานพาหนะก๊าซและการปฏิวัติไฟฟ้า แต่การเปลี่ยนแปลงที่ยิ่งใหญ่ที่สุดคือการปรับเปลี่ยนสถาปัตยกรรมพื้นฐานของสิ่งที่ทำให้รถ เมื่อรถยนต์ทุกคัน-ไฟฟ้าไฮบริดหรือก๊าซ-มีการกำหนดซอฟต์แวร์และเชื่อมต่อมากขึ้นความสามารถและความเป็นไปได้สำหรับประสบการณ์การขับขี่ที่สนุกสนานปลอดภัยและยั่งยืนมากขึ้นจะเพิ่มขึ้นอย่างทวีคูณ” Jajoo กล่าว</p><p><img src=""https://www.salesforce.com/news/wp-content/uploads/sites/3/2023/03/ConnectedCar.jpg?w=300""></p><p>อันที่จริงเขากล่าวว่ารถยนต์ที่เชื่อมต่อจะเชื่อมต่อไดรเวอร์ผู้ผลิตตัวแทนจำหน่ายและผู้ให้กู้รถยนต์ในรูปแบบที่สร้างประสบการณ์ที่เป็นส่วนตัวมากขึ้นและการบริการลูกค้าในระดับที่สูงขึ้น</p>",,,AlternateClause_Thai_One Description,CS_AllLanguage_1;Contract,Rich_Text,true,th,AlternateClause_Thai_One,,,,Draft,,,1
AlternateClause_Russian_One;CS_AllLanguage_1;Contract,,"<p><strong style=""font-size: 24px;""><em><u>Salesforce Automobile Partners</u></em></strong></p><p>В течение более столетия автомобили были символом инженерного мастерства из -за их оборудования: двигателей, трансмиссий, тормозов, оси и других физических частей. Однако теперь мы вошли в эру программного обеспечения, где программное обеспечение, а не аппаратное обеспечение, формирует опыт вождения.&nbsp;&nbsp;</p><ul><li>Понятие подключенного автомобиля развивалось в течение десятилетий. Системы общения в чрезвычайных ситуациях, которые позволяют драйверам обращаться за помощью к нажатию кнопки, существуют уже 30 лет./li><li>Постепенно было реализовано больше программного обеспечения для управления аппаратным и водительским опытом - и больше вычислительной мощности, данных и искусственного интеллекта позволило все, от маршрутизации GPS до уклонения от сбоя до автономного вождения. Программное средство, где программное обеспечение, а не аппаратное обеспечение, формирует опыт вождения.</li></ul><p>Некоторые автомобили, особенно технологические электромобили, являются предвестником программного обеспечения для доминирующей роли в автомобильном уравнении в будущем. Но автомобили, которые паркуются, предлагают руководство ближайшей газовой или зарядной станции, сигнализируют о необходимых ремонтах или натягивают любимые шоу ребенка-они не будут хорошими, премиальные функции в будущем, они придут стандартным на каждом автомобиле. И ключом к тому, чтобы эти переживания являются сотни бортовых датчиков и огромное количество данных, поступающих из автомобиля.</p><p><br></p><h2>«Сейсмический сдвиг» в автомобильной промышленности. В стенах Salesforce никто не может говорить с этими управляемыми данными, связанными автомобилями, лучше, чем&nbsp;<a href=""https://www.linkedin.com/in/achyutjajoo/"" rel=""noopener noreferrer"" target=""_blank"">Achyut Jajoo</a>Полем Несмотря на то, что он теперь является SVP и GM автомобильной и производства компании, Jajoo начал свою карьеру в качестве инженера в Детройте, проектируя автомобили и грузовики.</h2><p>Многие люди не до конца понимают, насколько сейсмическим сдвигом сегодня проходит автомобильная промышленность. Мы слышим о смерти газовых транспортных средств и электрической революции, но самой большой трансформацией является переосмысление основной архитектуры того, что делает автомобиль. После того, как все автомобили-электрические, гибридные или газ-станут более определенными программными и подключенными, возможности и возможности для более приятного, безопасного и устойчивого опыта вождения будут расти в геометрической прогрессии »,-говорит Джаджу.</p><p><img src=""https://www.salesforce.com/news/wp-content/uploads/sites/3/2023/03/ConnectedCar.jpg?w=300""></p><p>Действительно, по его словам, подключенный автомобиль будет связывать драйверов, производителей, дилеров и автомобильных кредиторов способами, которые создают более персонализированный опыт и более высокий уровень обслуживания клиентов.</p>",,,AlternateClause_Russian_One Description,CS_AllLanguage_1;Contract,Rich_Text,true,ru,AlternateClause_Russian_One,,,,Active,,,1
AlternateClause_Norwegian_One;CS_AllLanguage_1;Contract,,"<p><strong style=""font-size: 24px;""><em><u>Salesforce Automobile Partners</u></em></strong></p><p>I mer enn et århundre har biler vært et symbol på teknisk dyktighet på grunn av deres maskinvare: motorer, overføringer, bremser, aksler og andre fysiske deler. Nå har vi imidlertid kommet inn i tiden med det programvaredefinerte kjøretøyet der programvare, ikke maskinvare, former kjøreopplevelsen.&nbsp;&nbsp;</p><ul><li>Forestillingen om en tilkoblet bil har utviklet seg i flere tiår. Nødbaserte kommunikasjonssystemer som lar sjåførene ringe etter hjelp med trykk på en knapp har eksistert i 30 år ../li><li>Etter hvert er det blitt implementert mer programvare for å kontrollere maskinvare- og kjøreopplevelsen - og mer beregning av strøm, data og AI har muliggjort alt fra GPS -ruting til krasj unngåelse til autonom kjøring. & NBSP; nå har vi gått inn i epoken for den Programvaredefinert kjøretøy, der programvare, ikke maskinvare, former kjøreopplevelsen.</li></ul><p>Noen biler, spesielt de teknisk-fremover EV-ene, er en harbinger av den dominerende rolleprogramvaren vil spille i billigningen fremover. Men biler som parkerer seg selv, tilbyr veiledning til nærmeste gass- eller ladestasjon, signal trengte reparasjoner eller trekker opp et barns favorittprogram-disse vil ikke være fine å ha, premiumfunksjoner i fremtiden, de kommer standard på hvert kjøretøy. Og nøkkelen til å muliggjøre disse opplevelsene er hundrevis av sensorer ombord og enorme datamengder som kommer fra bilen.</p><p><br></p><h2>Et ‘seismisk skifte’ i bilindustrien. Innenfor veggene i Salesforce er det ingen som kan snakke med disse datadrevne, tilkoblede bilopplevelsene bedre enn&nbsp;<a href=""https://www.linkedin.com/in/achyutjajoo/"" rel=""noopener noreferrer"" target=""_blank"">Achyut Jajoo</a>. Selv om han nå er selskapets SVP og GM for bilindustri og produksjon, startet Jajoo sin karriere som ingeniør i Detroit, og designet biler og lastebiler.</h2><p>Mange mennesker forstår ikke helt hvor seismisk et skifte bilindustrien går gjennom i dag. Vi hører om døden av gassbiler og den elektriske revolusjonen, men den største transformasjonen er en reimagining av den underliggende arkitekturen til det som gjør en bil. Når alle biler-elektrisk, hybrid eller gass-er mer programvaredefinerte og tilkoblede, vil mulighetene og mulighetene for morsommere, trygge og bærekraftige kjøreopplevelser vokse eksponentielt, ”ifølge Jajoo.</p><p><img src=""https://www.salesforce.com/news/wp-content/uploads/sites/3/2023/03/ConnectedCar.jpg?w=300""></p><p>Faktisk, sa han, vil den tilkoblede bilen koble sjåfører, produsenter, forhandlere og bil långivere på måter som skaper mer personaliserte opplevelser og høyere nivåer av kundeservice.</p>",,,AlternateClause_Norwegian_One Description,CS_AllLanguage_1;Contract,Rich_Text,true,no,AlternateClause_Norwegian_One,,,,Draft,,,1
AlternateClause_English_Two;CS_AllLanguage_2;Retail,,"For more than a century, cars have been a symbol of engineering prowess because of their hardware: engines, transmissions, brakes, axles, and other physical parts. Now, however, we’ve entered the era of the software-defined vehicle where software, not hardware, shapes the driving experience.  

The notion of a connected car has been evolving for decades. Emergency-based communications systems that allow drivers to call for help with the push of a button have been around for 30 years. Gradually more software has been implemented to control the hardware and driving experience — and more compute power, data, and AI has enabled everything from GPS routing to crash avoidance to autonomous driving. 

Now, however, we’ve entered the era of the software-defined vehicle, where software, not hardware, shapes the driving experience.

Some cars, especially the tech-forward EVs, are a harbinger of the dominant role software will play in the automotive equation going forward. But cars that park themselves, offer guidance to the nearest gas or charging station, signal needed repairs, or pull up a child’s favorite shows — these won’t be nice-to-have, premium features in the future, they’ll come standard on every vehicle. And the key to enabling these experiences is the hundreds of onboard sensors and vast amounts of data coming from the car.

A ‘seismic shift’ in the auto industry
Within the walls of Salesforce, there’s nobody who can speak to these data-driven, connected car experiences better than Achyut Jajoo. Though he’s now the company’s SVP and GM of Automotive and Manufacturing, Jajoo started his career as an engineer in Detroit, designing cars and trucks.

“A lot of people don’t fully understand how seismic a shift the auto industry is going through today. We hear about the death of gas vehicles and the electric revolution, but the biggest transformation is a reimagining of the underlying architecture of what makes a car. Once all cars – electric, hybrid, or gas – are more software-defined and connected, the capabilities and possibilities for more enjoyable, safe, and sustainable driving experiences will grow exponentially,” according to Jajoo.

Indeed, he said, the connected car will connect drivers, manufacturers, dealers, and auto lenders in ways that create more personalized experiences and higher levels of customer service.

Once all cars – electric, hybrid, or gas – are more software-defined and connected, the capabilities and possibilities for more enjoyable, safe, and sustainable driving experiences will grow exponentially.

ACHYUT JAJOO, SVP AND GM, AUTOMOTIVE AND MANUFACTURING 
For one, cars will no longer be limited to the features and upgrades selected at a dealership. While some of the more advanced EVs have already started down this path, soon many more cars and trucks will be dynamic, instantly-upgradable machines thanks to the software, connectivity, and volumes of telemetry data that a car generates. 

“So now in real time, the data that is coming from the car can help shape the features and change the way you’re experiencing the car itself,” Jajoo said. 

For example, a car manufacturer may receive real-time telemetry data that one of their vehicles has started a road trip, but the driver doesn’t have trip optimization service installed. To help, they immediately send a notification through the car’s infotainment system to install the service. Now, the car’s software can show the driver the best rest stops, where to recharge or refuel at the lowest cost, and other features that will make the trip easier and more enjoyable.",,,AlternateClause_English_Two Description,CS_AllLanguage_2;Retail,Non_Formatted,true,en_US,AlternateClause_English_Two,,,,Draft,,,1
